date,username,to,replies,retweets,favorites,text,geo,mentions,hashtags,id,permalink
2020-03-26 23:53:59,alintaenergy,__tim_c,1,0,0,"Hi Tim, apologies for the delay in response as you can imagine we are experiencing longer than usual wait times due to the impact of the Coronavirus (COVID-19). However, I'd be happy to help you - please feel free to reach out via private message :) Thanks, Ada. https://twitter.com/messages/compose?recipient_id=744189877",,,,1243325355592744962,https://twitter.com/alintaenergy/status/1243325355592744962
2020-03-26 23:53:59,ashleyplumexo,,0,0,0,"I’d like to wake up from this bad dream that is Coronavirus. I miss people, can we have a 2020 do-over please? #COVID19 #QuarantineLife #bored",,,#COVID19 #QuarantineLife #bored,1243325354858725380,https://twitter.com/ashleyplumexo/status/1243325354858725380
2020-03-26 23:53:58,4kpop,,0,0,0,"I just gave one of my diy fabric mask to someone for free and they were so happy about it and it made me feel happy too. I guess it's the little things we can do that can help make it feel big! #coronavirus #CoronavirusOubreak #COVID19 #facemask",,,#coronavirus #CoronavirusOubreak #COVID19 #facemask,1243325352249831426,https://twitter.com/4kpop/status/1243325352249831426
2020-03-26 23:53:58,2020science,,0,1,2,"One of the best articles I’ve come across on covid-19 &amp; use of face masks: Can Face Masks Protect You from the 2019 Coronavirus? What Types, When and How to Use https://www.healthline.com/health/coronavirus-mask via @Healthline",,@Healthline,,1243325350379053056,https://twitter.com/2020science/status/1243325350379053056
2020-03-26 23:53:53,NerdStewy,,0,0,0,"Please retweet! Stay Inside! Think of those that you know and love that have pre-existing health issues, think of your children, parents, siblings. Think of those out of work. The only way this ends fast is if you stay inside. #COVID19 #coronavirus ",,,#COVID19 #coronavirus,1243325331869597696,https://twitter.com/NerdStewy/status/1243325331869597696
2020-03-26 23:53:53,diverdown48,,0,0,0,"Bill Gates on coronavirus: We need an 'extreme shutdown' of 6 to 10 weeks self made billionaire not like #DonTheCon https://finance.yahoo.com/news/bill-gates-on-coronavirus-161803530.html #Coronavirusnyc #COVID19 #COVID #stayhome #coronavirus #CoronavirusOutbreak #CoronavirusPandemic #CoronaVirusChallenge #quarantine",,,#DonTheCon #Coronavirusnyc #COVID19 #COVID #stayhome #coronavirus #CoronavirusOutbreak #CoronavirusPandemic #CoronaVirusChallenge #quarantine,1243325330879905796,https://twitter.com/diverdown48/status/1243325330879905796
2020-03-26 23:53:53,mikecane,,1,0,1,"New York City: 38,977 cases Wuhan: 50,006 Latest Wuhan figure from DXY. We will surpass. #coronavirus #COVID19 #tFv",,,#coronavirus #COVID19 #tFv,1243325329420292101,https://twitter.com/mikecane/status/1243325329420292101
2020-03-26 23:53:52,drsharmatoishi,,0,0,3,"Haven’t heard birds chirping so happily outside my apartment in years ! Does nature like corona ? Have you had any similar experiences? Are WE the virus that Mother Nature is trying to work on ? #naturelikescorona #CoronavirusOubreak #coronavirus #COVID19 ",,,#naturelikescorona #CoronavirusOubreak #coronavirus #COVID19,1243325325733396482,https://twitter.com/drsharmatoishi/status/1243325325733396482
2020-03-26 23:53:50,maggiernbsn,Acosta,0,0,0,"It's a tribute to INSUFFICIENT testing due to inadequate preparation by Trump adm. 'High number' isn't ACTUAL #of coronavirus cases. ""All countries should be able to test all suspected cases, they cannot fight this pandemic blindfolded."" ~ #WHO #COVID19 ",,,#WHO #COVID19,1243325316870832129,https://twitter.com/maggiernbsn/status/1243325316870832129
2020-03-26 23:53:47,thelorereport,,0,0,0,"The latest World News! https://www.thelorereport.ie/paper-li/ Thanks to @BorgJake @ASwirlGirl @augcullaw #coronavirus #covid19",,@BorgJake @ASwirlGirl @augcullaw,#coronavirus #covid19,1243325308088000513,https://twitter.com/thelorereport/status/1243325308088000513
2020-03-26 23:53:42,Sen_JoeManchin,,1,2,13,"Our state and local governments are on the front lines of the #COVID19 response effort. That’s why I’m proud to have secured no less than $1.25 billion for WV in the Coronavirus Relief Fund, which also includes lending for distressed states, municipalities, and businesses.",,,#COVID19,1243325284268597248,https://twitter.com/Sen_JoeManchin/status/1243325284268597248
2020-03-26 23:53:40,MariaSantanaCNN,,0,0,0,"Rush hour on the #LongIslandExpressway @LIE #StayAtHome #Coronavirus #covid_19 https://www.instagram.com/p/B-N0vGFB72s/?igshid=1f7o6wvubsmhq",,@lie,#LongIslandExpressway #StayAtHome #Coronavirus #covid_19,1243325276089704449,https://twitter.com/MariaSantanaCNN/status/1243325276089704449
2020-03-26 23:53:40,DenisGobo,,0,0,0,"Okay WTF???? https://loveinhome.com/collections/paper-towels Precious commodities ??#COVID19 #coronavirus #pricegouging",,,#COVID19 #coronavirus #pricegouging,1243325274806194176,https://twitter.com/DenisGobo/status/1243325274806194176
2020-03-26 23:53:39,rwang0,yorkerhodes,1,0,2,"MyPOV: we do have the webinar license so you can capture reg there. @gotowebinar does a good job with that. #coronavirus #covid19 #SARS_COV_2 #wfh #futureofwork",,@gotowebinar,#coronavirus #covid19 #SARS_COV_2 #wfh #futureofwork,1243325273052811265,https://twitter.com/rwang0/status/1243325273052811265
2020-03-26 23:53:38,TekAdvisoryGRP,,0,0,0,"The CDC self checklist for Covid-19. https://www.cdc.gov/coronavirus/2019-ncov/symptoms-testing/symptoms.html #Covid19usa #COVID #coronavirus",,,#Covid19usa #COVID #coronavirus,1243325269177331712,https://twitter.com/TekAdvisoryGRP/status/1243325269177331712
2020-03-26 23:53:37,Doctorshaib,,0,4,4,"My interview with @anewscomtr , ANEWS Turkey. I managed to mention worrying issues, such as the mismanagement of #coronavirus , #COVID19 in the USA. We also discussed the origin of novel viruses and preventative measures which are worth undertaking. ",,@anewscomtr,#coronavirus #COVID19,1243325264811130885,https://twitter.com/Doctorshaib/status/1243325264811130885
2020-03-26 23:53:37,_Nyaga_B,,0,0,0,"This Corona virus pandemic has already decided most coming elections. #COVID19",,,#COVID19,1243325263053758465,https://twitter.com/_Nyaga_B/status/1243325263053758465
2020-03-26 23:53:37,SCFC1983EW,,1,0,0,"When Viruses cause diseases they often have a different name than the infecting bug. rubeola virus = Disease measles varicella zoster virus = ChickenPox Corona Virus = Covid19 so if someone says ""corona Virus"" They are talking specifically about the pathogen not its effects.",,,,1243325262244216832,https://twitter.com/SCFC1983EW/status/1243325262244216832
2020-03-26 23:53:36,DrGJackBrown,_esaliba,32,237,578,"""Whoever Saves a Life Saves the World"" Kious Kelly, RN — Remember his name. #Coronavirus #COVID19 ",,,#Coronavirus #COVID19,1243325260830658560,https://twitter.com/DrGJackBrown/status/1243325260830658560
2020-03-26 23:53:36,voteUSNP,,0,0,0,".@DuPageCounty How bout a map of #coronavirus hotspots in DuPage County so people can easily avoid these areas, therefore preventing the spread of this virus during this crisis! #COVIDActNow #COVID19 #StayAtHomeOrder #LockdownNow #COVIDー19 #CoronavirusPandemic #CoronaVirusUpdate",,@DuPageCounty,#coronavirus #COVIDActNow #COVID19 #StayAtHomeOrder #LockdownNow #COVID #CoronavirusPandemic #CoronaVirusUpdate,1243325258616188928,https://twitter.com/voteUSNP/status/1243325258616188928
2020-03-26 23:53:36,recosel,,0,1,1,"We know you've heard it before but IT MATTERS.⠀⠀⠀⠀⠀⠀⠀⠀⠀ #WellGetThroughThis #COVID19 #coronavirus #StayHomeSA #COVIDー19 #Quarantine",,,#WellGetThroughThis #COVID19 #coronavirus #StayHomeSA #COVID #Quarantine,1243325258398081024,https://twitter.com/recosel/status/1243325258398081024
2020-03-26 23:53:34,newventureman,uppsalamats,1,1,2,"If this is true, then #Sweden is holding the official number of deaths low by just not counting people who die at home... Why are we not reading about that @dagensnyheter @Expressen @svtnyheter? #coronavirus #COVID19 ",,@dagensnyheter @Expressen @svtnyheter,#Sweden #coronavirus #COVID19,1243325251397844998,https://twitter.com/newventureman/status/1243325251397844998
2020-03-26 23:53:33,Jvirden22,drewbrees,0,0,0,"THIS... *tears swelling up* ... this is going to help so many people in Louisiana. Thank you @drewbrees and family!!! #InThisTogether #NotMeUs #COVID19 #COVID2019 #coronavirus #CoronavirusOutbreak #CoronavirusPandemic",,@drewbrees,#InThisTogether #NotMeUs #COVID19 #COVID2019 #coronavirus #CoronavirusOutbreak #CoronavirusPandemic,1243325246964477956,https://twitter.com/Jvirden22/status/1243325246964477956
2020-03-26 23:53:32,michaeldiaz101,,0,0,0,"March 10th: ""And we’re prepared, and we’re doing a great job with it. And it will go away. Just stay calm. It will go away."" - @realDonaldTrump Way to #MAGA! #covid19 #coronavirus #covid19michigan",,@realDonaldTrump,#MAGA #covid19 #coronavirus #covid19michigan,1243325241100820480,https://twitter.com/michaeldiaz101/status/1243325241100820480
2020-03-26 23:53:31,Psycojimi,HamillHimself,0,1,30,"She was refused the test because she showed no symptoms of Covid19, she had an abdominal infection, not a respiratory issue, clearly the hospital saves the tests for those who have corona virus symptoms.",,,,1243325240543006724,https://twitter.com/Psycojimi/status/1243325240543006724
2020-03-26 23:53:20,BLeeJones,,0,0,0,"Building a COVID-19 Vulnerability Index #covi19 #coronavirus #vulnerability",,,#covi19 #coronavirus #vulnerability,1243325194430582784,https://twitter.com/BLeeJones/status/1243325194430582784
2020-03-26 23:53:20,keithpp,yanisvaroufakis,0,1,4,"Coronavirus has shown EU to be irrelevant. First borders close and now this. European countries need to work together and bypass EU. #coronavirus #covid19 #EU #Europe #democracy @DiEM_25",,@DiEM_25,#coronavirus #covid19 #EU #Europe #democracy,1243325191247331328,https://twitter.com/keithpp/status/1243325191247331328
2020-03-26 23:53:18,MuhumuzaJulia,,0,1,2,"#COVID19 is a killer pandemic that is intending to take millions of lives in this generation, but Together let's fight #CoronaVirus through sensitising people surrounding about the prevention measures like #covering… https://www.instagram.com/p/B-N0sPchjyZ/?igshid=1ok7i3ffmate1",,,#COVID19 #CoronaVirus #covering,1243325186100903938,https://twitter.com/MuhumuzaJulia/status/1243325186100903938
2020-03-26 23:53:18,hughcoram,,0,0,0,"COVID-19: track coronavirus cases - http://GOV.UK",,,,1243325183752056837,https://twitter.com/hughcoram/status/1243325183752056837
2020-03-26 23:53:16,VirusBuster11,realDonaldTrump,0,0,0,"China is raging the biological war against the world without declaring it. #ChineseVirus #coronavirus #COVID2019 #COVIDー19 #covid19 #HoldChinaAccountable",,,#ChineseVirus #coronavirus #COVID2019 #COVID #covid19 #HoldChinaAccountable,1243325176667934722,https://twitter.com/VirusBuster11/status/1243325176667934722
2020-03-26 23:53:16,BrysonDD,,1,0,2,"We need this guy's blood! 101 year old man, born during the Spanish flu, has beaten #Covid-19 #coronavirus in Italy http://www.today.it/attualita/coronavirus-guarisce-101-anni-rimini.html #ForzaItalia",,,#Covid #coronavirus #ForzaItalia,1243325175296229377,https://twitter.com/BrysonDD/status/1243325175296229377
2020-03-26 23:53:16,WilliamLial,leofreiremusic,0,0,0,"Great! #Queen #Rock #BrianMay #COVID19 #coronavirus ",,,#Queen #Rock #BrianMay #COVID19 #coronavirus,1243325174746959878,https://twitter.com/WilliamLial/status/1243325174746959878
2020-03-26 23:53:15,PascoGovAffairs,,1,4,11,"Jonus Goldstein #PascoProud! You have a great future ahead of you: Pasco County high school student creating 3D printed masks to help nurses and first responders @pascoschools @JWMHS #COVID19 #coronavirus ",,@pascoschools @JWMHS,#PascoProud #COVID19 #coronavirus,1243325172444209153,https://twitter.com/PascoGovAffairs/status/1243325172444209153
2020-03-26 23:53:13,b_nykt,,0,0,0,"Coronavirus: France's homeless 'fined for not staying indoors' during COVID-19 lockdown ",,,,1243325161723445248,https://twitter.com/b_nykt/status/1243325161723445248
2020-03-26 23:53:13,sanjayrajsingh,,7,45,106,"How do major pandemics affect economic activity in the longer term? My colleagues (Òscar Jordà, Alan Taylor) and I have a new working paper where we answer this question. #coronavirus #COVID19 #CoronavirusPandemic #BlackDeath #SpanishFlu #SecularStagnation #NaturalRate 1/5",,,#coronavirus #COVID19 #CoronavirusPandemic #BlackDeath #SpanishFlu #SecularStagnation #NaturalRate,1243325161543069697,https://twitter.com/sanjayrajsingh/status/1243325161543069697
2020-03-26 23:53:10,waxmanj,AriFleischer,0,1,3,"This is ridiculous - it was commonly known as coronavirus or COVID-19. He’s only calling it something different to be provocative and score political points. It would be like if someone called the Iraq War the “War Caused By Ari and his Colleagues Lying to the American People”",,,,1243325152051552258,https://twitter.com/waxmanj/status/1243325152051552258
2020-03-26 23:53:10,AmierHaidar,,1,3,13,"We're number 1 in reported #Coronavirus cases, scary part is we're still under testing &amp; hospitals are playing catch up. #COVID19",,,#Coronavirus #COVID19,1243325151724351489,https://twitter.com/AmierHaidar/status/1243325151724351489
2020-03-26 23:53:10,demorants,AriFleischer,0,0,0,"I don’t get the controversy here. Well I do it’s political food fighting nonsense. But why don’t we ask Asians if they’re offended by the term China Virus. If they are, why go out of the way to offend them? Is there something wrong with corona virus? or covid 19? Why another name",,,,1243325149442715649,https://twitter.com/demorants/status/1243325149442715649
2020-03-26 23:53:08,taehyungister,washingtonpost,0,0,0,"Why is the US so obsessed with names. Just fucking call it COVID-19 or coronavirus. Like period. Start taking care of your own damn people please. They're dying and jobs are being lost. This is freaking ridiculous.",,,,1243325142891143168,https://twitter.com/taehyungister/status/1243325142891143168
2020-03-26 23:53:05,Graphenes1,,1,0,1,"Three unaccompanied migrant children in U.S. custody have tested positive for coronavirus, according to the Office of Refugee Resettlement. #COVID19 Six staff members recently tested positive for coronavirus, ORR said Thursday. ",,,#COVID19,1243325129389727745,https://twitter.com/Graphenes1/status/1243325129389727745
2020-03-26 23:53:05,barbara_volkwyn,,0,1,1,"Oh no, God help us. China reports deeply disturbing coronavirus development https://7news.com.au/lifestyle/healthmedicine/china-reports-deeply-disturbing-coronavirus-development-c-765460?utm_campaign=share-icons&amp;utm_source=twitter&amp;utm_medium=social&amp;tid=1585264794990 #coronavirus #coronavirussa #coronavirusinsa #covid19sa #coronavirusafrica #covid-19 #covid19",,,#coronavirus #coronavirussa #coronavirusinsa #covid19sa #coronavirusafrica #covid #covid19,1243325128940929024,https://twitter.com/barbara_volkwyn/status/1243325128940929024
2020-03-26 23:53:04,Cognito3000,,0,0,0,"Wouldn’t that be great? #COVID19 #coronavirus #pandemic @Twitter",,@Twitter,#COVID19 #coronavirus #pandemic,1243325126491271168,https://twitter.com/Cognito3000/status/1243325126491271168
2020-03-26 23:53:04,airschis,,0,0,0,"#Covid-19 #Coronavirus What we’ve learned about the coronavirus — and what we still need to know https://www.statnews.com/2020/03/26/what-weve-learned-about-the-coronavirus-and-what-we-still-need-to-know/ via @statnews",,@statnews,#Covid #Coronavirus,1243325126218674177,https://twitter.com/airschis/status/1243325126218674177
2020-03-26 23:53:04,lukeduf53255102,Draccus874,0,0,0,"“new study published in Nature Medicine found that the true mortality rate of Coronavirus COVID-19 in China has been GROSSLY overestimated by the World Health Organization (Wu et al. 2020: http://nature.com/articles/s4159…). The new estimate is similar to mortality of seasonal influenza”",,,,1243325125350612992,https://twitter.com/lukeduf53255102/status/1243325125350612992
2020-03-26 23:53:01,ArtieVandelay1,realDonaldTrump,4,4,7,"China has FOUR TIMES as many people as we do in America!! And already we have MORE #Coronavirus cases than they do You have failed us in ways unimaginable before your Presidency Thousands and thousands and thousands will die Because of YOU. #COVID19 #CongratulationsAmerica",,,#Coronavirus #COVID19 #CongratulationsAmerica,1243325111807217672,https://twitter.com/ArtieVandelay1/status/1243325111807217672
2020-03-26 23:52:56,EvanNBC5,ChauncyOnTV,0,2,1,"Houston anchor @ChauncyOnTV tests positive for coronavirus. At home recovering. Another reminder of how serious #COVID19 is. ",,@ChauncyOnTV,#COVID19,1243325093373247488,https://twitter.com/EvanNBC5/status/1243325093373247488
2020-03-26 23:52:56,nudity_n,,0,0,0,"People not concerned with #COVID19 A.) Virus is a real #pandemic and concern should be real Or B.) The virus isn’t real and we should be concerned the #wholeworldlockdown for nothing, why? #COVIDIOTS #coronavirus #TREASURE",,,#COVID19 #pandemic #wholeworldlockdown #COVIDIOTS #coronavirus #TREASURE,1243325093301776384,https://twitter.com/nudity_n/status/1243325093301776384
2020-03-26 23:52:55,mohsin,,0,0,0,"Today we clapped for them. Keep on fighting that good fight. Be well everyone #clapforourcarers #clapforthenhs #nhs #northyorkshire #harrogate #covid_19 #coronavirus @Harrogate, North Yorkshire https://www.instagram.com/p/B-N0knIldxQ/?igshid=6z8o6myk9lmb",,,#clapforourcarers #clapforthenhs #nhs #northyorkshire #harrogate #covid_19 #coronavirus,1243325086851104768,https://twitter.com/mohsin/status/1243325086851104768
2020-03-26 23:52:53,Nauman_RKhan,,0,0,3,"Watch LIVE Islamic Bayan every Friday at 1:00 pm GMT #coronavirus #COVID19 #lockdown #Islamic #Jummah",,,#coronavirus #COVID19 #lockdown #Islamic #Jummah,1243325080135962625,https://twitter.com/Nauman_RKhan/status/1243325080135962625
2020-03-26 23:52:52,HebdenAntiques,,0,0,0,"We must use social distancing to reduce the spread of coronavirus (COVID-19) in the UK. See how the virus is developing in your local area and across the UK using this site. ",,,,1243325074398228489,https://twitter.com/HebdenAntiques/status/1243325074398228489
2020-03-26 23:52:49,sakib_sibgat,,0,0,0,"#Staying_home_during_epidemic_plague #Plague_is_Martyrdom #Corona_virus #COVID_19⁣ ⁣ https://youtu.be/bQLwMlembUA - explanation of the hadeeth in arabic⁣ ⁣ Ibn Hajr (may Allah have mercy… https://www.instagram.com/p/B-N0o0kF-8BxTfszAKcnbYCT1ZM3WJoOJoLlNw0/?igshid=9tdaps17uz7b",,,#Staying_home_during_epidemic_plague #Plague_is_Martyrdom #Corona_virus #COVID_19,1243325062712868864,https://twitter.com/sakib_sibgat/status/1243325062712868864
2020-03-26 23:52:49,Clarksville_TN,,0,1,1,"101st Airborne Division, Fort Campbell dependent tests positive for Coronavirus #clarksville #clarksvilletn #montgomerycounty #fortcampbell #fortcampbellky #101stairborne #coronavirus #covid-19 #nashville #tennessee #news https://www.clarksvilleonline.com/2020/03/26/101st-airborne-division-fort-campbell-dependent-tests-positive-for-coronavirus/",,,#clarksville #clarksvilletn #montgomerycounty #fortcampbell #fortcampbellky #101stairborne #coronavirus #covid #nashville #tennessee #news,1243325060842217474,https://twitter.com/Clarksville_TN/status/1243325060842217474
2020-03-26 23:52:48,VoteDEGRAMMONT,,0,0,1,"Internal Emails Show How Chaos at the CDC Slowed the Early Response to Coronavirus A must read! #cdc #coronavirus #COVID19 ",,,#cdc #coronavirus #COVID19,1243325059541811200,https://twitter.com/VoteDEGRAMMONT/status/1243325059541811200
2020-03-26 23:52:47,charann130,,0,0,0,"Coronavirus Florida: U.S. passes Italy, China for as nation with the most confirmed cases of COVID-19 ",,,,1243325055905476608,https://twitter.com/charann130/status/1243325055905476608
2020-03-26 23:52:46,KayandNnn,,1,0,0,"• Novel coronavirus (COVID-19) cases by country worldwide 2020 | Statista https://www.statista.com/statistics/1043366/novel-coronavirus-2019ncov-cases-worldwide-by-country/",,,,1243325049056063488,https://twitter.com/KayandNnn/status/1243325049056063488
2020-03-26 23:52:45,MrGreatLtd,,0,0,0,"Staying apart is the great way to stay united. #corona #Coronavirus #covid_19 #covid #stayapart #covid19 #epidemic #pendemic #stayhomestaysafe #mrgreat #mrgreatltd #covid",,,#corona #Coronavirus #covid_19 #covid #stayapart #covid19 #epidemic #pendemic #stayhomestaysafe #mrgreat #mrgreatltd #covid,1243325045474234371,https://twitter.com/MrGreatLtd/status/1243325045474234371
2020-03-26 23:52:44,Duane34844672,,0,0,0,"@Wendys you had me at #honeybutter. #SocialDistancing due to #coronavirus #COVID19 is easier when you have a sweet honey butter chicken biscuit to keep you company. #blessed #freshneverfrozen. Stay safe and strong stay inside.",,@Wendys,#honeybutter #SocialDistancing #coronavirus #COVID19 #blessed #freshneverfrozen,1243325043616231431,https://twitter.com/Duane34844672/status/1243325043616231431
2020-03-26 23:52:43,Haikus2You,,0,0,0,"United States Coronavirus (COVID-19) Tracker https://infection2020.com/",,,,1243325038478024704,https://twitter.com/Haikus2You/status/1243325038478024704
2020-03-26 23:52:41,UNDGC_CSO,,1,5,9," Civil society organizations helping communities during the #COVID19 pandemic, we call for your stories! Share your experience with us and we will share it with the civil society community. Submit https://bit.ly/CSOrespondtoCOVID19 Let's fight #coronavirus together #UNwithCivilSociety",,,#COVID19 #coronavirus #UNwithCivilSociety,1243325029380734978,https://twitter.com/UNDGC_CSO/status/1243325029380734978
2020-03-26 23:52:41,BSWbuzz,,0,0,0,"My “New Normal.” #coronavirus #masks #rubbergloves #covıd19 #exerciseroutine #protectyourself #pandemic2020 @Ralphs https://www.instagram.com/p/B-N0KbJJuZb/?igshid=hgc6psbxnmnk",,,#coronavirus #masks #rubbergloves #cov #exerciseroutine #protectyourself #pandemic2020,1243325028294328327,https://twitter.com/BSWbuzz/status/1243325028294328327
2020-03-26 23:52:40,mongank,,0,0,1,"Crikey looks like the US is going to take a big hit for delaying over tackling the virus. Trump has another hunch that it'll be sorted in 3 weeks... good luck with that #COVID19 #usaCoronavirus BBC News - Coronavirus: US overtakes China with most cases ",,,#COVID19 #usaCoronavirus,1243325023974285318,https://twitter.com/mongank/status/1243325023974285318
2020-03-26 23:52:39,2536luis,,0,0,0,"France pulls out military forces in Iraq amid virus demands #CoronavirusOutbreak #COVID19 #coronavirus ",,,#CoronavirusOutbreak #COVID19 #coronavirus,1243325020702572544,https://twitter.com/2536luis/status/1243325020702572544
2020-03-26 23:52:39,ImMattOlsen,,0,0,0,"Retweet - Verizon to pledge $10 for each tweet with the hashtag > #PayItForwardLIVE to support small business @verizon #COVID19 #coronavirus ",,@verizon,#PayItForwardLIVE #COVID19 #coronavirus,1243325019406680064,https://twitter.com/ImMattOlsen/status/1243325019406680064
2020-03-26 23:52:35,MurugiMurekio,,0,0,0,"It’s here US now leads world in confirmed #COVID-19 cases https://kutv.com/news/coronavirus/us-now-leads-world-in-confirmed-covid-19-cases #coronavirus",,,#COVID #coronavirus,1243325002327502849,https://twitter.com/MurugiMurekio/status/1243325002327502849
2020-03-26 23:52:34,maltbyg72,,0,0,0,"@handpickedweth""UK government says self-employed will get coronavirus grants worth 80% of their average earnings"" #COVID19 ",,@handpickedweth,#COVID19,1243325000960094212,https://twitter.com/maltbyg72/status/1243325000960094212
2020-03-26 23:52:34,rositajones,,0,0,0,"Well, I guess we’re finally number one again in something... #coronavirus #coronapocalypse #COVID19 #shame",,,#coronavirus #coronapocalypse #COVID19 #shame,1243325000570019841,https://twitter.com/rositajones/status/1243325000570019841
2020-03-26 23:52:34,rima_ezz,,0,0,0,"The US now has the most cases of Corona virus in the world!!!! I assume Italy will surpass China within 24 hours!! #COVID19",,,#COVID19,1243324998384857089,https://twitter.com/rima_ezz/status/1243324998384857089
2020-03-26 23:52:33,Raj31792910,Mankya,0,0,1,": SARS and MERS are families of Corona virus that emerged from mutation off - musk cats and camels. COVID19 off- pangolins. Primary origination are bats.",,,,1243324996891684871,https://twitter.com/Raj31792910/status/1243324996891684871
2020-03-26 23:52:32,HaroldLifeC,,0,1,1,"Our collective struggle to fight COVID-19 coronavirus https://www.kevinmd.com/blog/2020/03/our-collective-struggle-to-fight-covid-19-coronavirus.html via @kevinmd",,@kevinmd,,1243324992957247488,https://twitter.com/HaroldLifeC/status/1243324992957247488
2020-03-26 23:52:32,CedarFallsWater,,0,0,0,"DHS: 10 deaths, 707 tested positive for COVID-19 in Wisconsin - WMTV: * DHS: 10 deaths, 707 tested positive for COVID-19 in Wisconsin WMTV * Confirmed coronavirus cases in Wisconsin up to 585 http://Fox11online.com * View Full Coverage on Google News",,,,1243324992424513536,https://twitter.com/CedarFallsWater/status/1243324992424513536
2020-03-26 23:52:30,Berean122,,0,0,0,"Prof. Francis Boyle Update on Coronavirus Bioweapon https://youtu.be/3DAI3c9wE0Q via @YouTube an expert confirming what a lot of us thought covid-19 was!! Pls watch!",,@YouTube,,1243324982433906691,https://twitter.com/Berean122/status/1243324982433906691
2020-03-26 23:52:27,_1BUV,,0,0,0,"#Calls to the National #Suicide Prevention Hotline have spiked 300% amid the coronavirus #Pandemic, according to KVLY, while the Sacramento Bee reports that other #Suicide prevention services have similarly risen for the same ... #Covid19 https://1buv.com/i-would-rather-be-dead-calls-to-suicide-hotlines-spike-amid-covid-19-pandemic/",,,#Calls #Suicide #Pandemic #Suicide #Covid19,1243324970391834624,https://twitter.com/_1BUV/status/1243324970391834624
