date,username,to,replies,retweets,favorites,text,geo,mentions,hashtags,id,permalink
2020-03-26 23:49:16,relaese,,0,0,1,"Coronavirus: Why Germany has such a low COVID-19 death rate ",,,,1243324170177519617,https://twitter.com/relaese/status/1243324170177519617
2020-03-26 23:49:16,GollyMollyB,,2,0,1,"Trump campaign threatens legal action against coronavirus ad quoting him #congratulationsamerica #covid19 https://www.msnbc.com/morning-joe/watch/trump-campaign-threatens-legal-action-of-coronavirus-ad-81229893822 via @msnbc",,@MSNBC,#congratulationsamerica #covid19,1243324168827023360,https://twitter.com/GollyMollyB/status/1243324168827023360
2020-03-26 23:49:13,alpinesucre,,0,0,0,"Coronavirus: Britons saying final goodbyes to dying relatives by videolink - Restrictions on visits to patients with Covid-19 mean such farewells are increasingly necessary via /r/technology ",,,,1243324156365733889,https://twitter.com/alpinesucre/status/1243324156365733889
2020-03-26 23:49:13,verses_by_mansa,adjoabb,0,0,0,"People am don’t actually know that SARS AND MERS corona I too. They attribute every mention of coronavirus to Covid 19",,,,1243324156307013633,https://twitter.com/verses_by_mansa/status/1243324156307013633
2020-03-26 23:49:12,Covid19DentRes,,0,0,0,"[Correspondence] COVID-19 gives the lie to global health expertise https://ift.tt/2QND8Fc #coronavirus #lancet",,,#coronavirus #lancet,1243324154264399876,https://twitter.com/Covid19DentRes/status/1243324154264399876
2020-03-26 23:49:12,RealCoreyScott,,0,0,0,"If you think we have to protect our freedoms by sacrificing some if them, don't talk to me about oppression. I don't have time to listen to statist bullshit. #COVID19 #coronavirus #CongratulationsAmerica",,,#COVID19 #coronavirus #CongratulationsAmerica,1243324152775401473,https://twitter.com/RealCoreyScott/status/1243324152775401473
2020-03-26 23:49:12,Covid19DentRes,,0,0,0,"[Correspondence] A citizen's thoughts about COVID-19 https://ift.tt/3dv9EWl #coronavirus #lancet",,,#coronavirus #lancet,1243324152590680065,https://twitter.com/Covid19DentRes/status/1243324152590680065
2020-03-26 23:49:11,COVID19USA,,0,0,0,"Calculate your #US #coronavirus stimulus check. ",,,#US #coronavirus,1243324148446887936,https://twitter.com/COVID19USA/status/1243324148446887936
2020-03-26 23:49:11,jenbeccyRN,,0,1,3,"Trump failed to mount an adequate response to the #COVID19 outbreak so he’ll just lie and try to place blame others like the Media, Obama , China... Trump works to rewrite narrative on coronavirus response - POLITICO ",,,#COVID19,1243324148304302083,https://twitter.com/jenbeccyRN/status/1243324148304302083
2020-03-26 23:49:10,DavidWa59907969,,0,1,1,"‘Send everybody home’: potential coronavirus outbreak at Site C dam a threat to Fort St. John, local officials say: https://thenarwhal.ca/send-everybody-home-potential-coronavirus-outbreak-at-site-c-dam-a-threat-to-fort-st-john-local-officials-say/ #bcpoli #COVID19",,,#bcpoli #COVID19,1243324145170931712,https://twitter.com/DavidWa59907969/status/1243324145170931712
2020-03-26 23:49:08,richiesheerin,,2,0,0,"Has the #COVID19 #COVIDー19 #coronavirus data been broken down by county in the North yet? @sinnfeinireland @allianceparty @duponline @SDLPlive @JoeBrolly1993 @healthdpt @nidirect",,@sinnfeinireland @allianceparty @duponline @SDLPlive @JoeBrolly1993 @healthdpt @nidirect,#COVID19 #COVID #coronavirus,1243324137235456002,https://twitter.com/richiesheerin/status/1243324137235456002
2020-03-26 23:49:08,Reem_Abdellatif,,1,3,4,"The US has officially, and quite rapidly surpassed China in the total number of #COVID19 cases. Absolutely devastating. #coronavirus ",,,#COVID19 #coronavirus,1243324134978969601,https://twitter.com/Reem_Abdellatif/status/1243324134978969601
2020-03-26 23:49:08,Jennifer_Grayy,,0,0,0,"""People embrace conspiracy theories because they're afraid. The remedy is to make them feel empowered"" #climatechange #COVID19 Coronavirus shows how to fight disinformation about climate change ",,,#climatechange #COVID19,1243324134710337537,https://twitter.com/Jennifer_Grayy/status/1243324134710337537
2020-03-26 23:49:05,TJSullivanLA,realDonaldTrump,0,0,0,"Wow. He really does sound more and more like Jesus Christ every day … #coronavirus #COVID19 #COVID2019",,,#coronavirus #COVID19 #COVID2019,1243324123390054402,https://twitter.com/TJSullivanLA/status/1243324123390054402
2020-03-26 23:49:03,PaperbirdsH,,0,0,0,"In the news: What's Inside The Senate's $2 Trillion Coronavirus Aid Package http://link.paperbirds.me/RSdTDh #coronavirus #COVID19 #2019ncov",,,#coronavirus #COVID19 #2019ncov,1243324114992951296,https://twitter.com/PaperbirdsH/status/1243324114992951296
2020-03-26 23:49:03,PaperbirdsH,,0,0,0,"In the news: WATCH: White House Holds Briefing As Officials Work On New Coronavirus Guidelines http://link.paperbirds.me/RSdTDY #coronavirus #COVID19 #2019ncov",,,#coronavirus #COVID19 #2019ncov,1243324113927557120,https://twitter.com/PaperbirdsH/status/1243324113927557120
2020-03-26 23:49:03,PaperbirdsH,,0,0,0,"In the news: How you can keep thousands of people from getting coronavirus, in one GIF http://link.paperbirds.me/RSdTBj #coronavirus #COVID19 #2019ncov",,,#coronavirus #COVID19 #2019ncov,1243324112895803392,https://twitter.com/PaperbirdsH/status/1243324112895803392
2020-03-26 23:49:02,kiwicom247,iffydamzzy,0,0,0,"Hi Luther, we apologize for the delay. We are currently experiencing an increased volume of incoming messages due to the Coronavirus/COVID-19 outbreak. One of our colleagues will attend to you once available. Thank you.",,,,1243324111708991497,https://twitter.com/kiwicom247/status/1243324111708991497
2020-03-26 23:49:02,running_kids,,0,0,0,"Some of us remember one-hit wonder The Knack with their hit ""My Sharona"". Well remaining band members do a #coronavirus parody ""My Corona"" with some helpful health tips. #covid19 #staypositive",,,#coronavirus #covid19 #staypositive,1243324109645328388,https://twitter.com/running_kids/status/1243324109645328388
2020-03-26 23:49:00,host24_space,,0,0,0,"Coronavirus outbreak: Trump calls large number of COVID-19 cases ‘tribute’ to U.S. testing | FULL https://host24.space/coronavirus-outbreak-trump-calls-large-number-of-covid-19-cases-tribute-to-u-s-testing-full/",,,,1243324103802658816,https://twitter.com/host24_space/status/1243324103802658816
2020-03-26 23:49:00,fsdeditor,,0,0,1,"The cafeteria has been closed to the public due to COVID-19. #covid19 #coronavirus #foodservice #healthcare",,,#covid19 #coronavirus #foodservice #healthcare,1243324101164322817,https://twitter.com/fsdeditor/status/1243324101164322817
2020-03-26 23:48:57,OracleLaura,,0,0,0,"Coronavirus COVID-19 deaths reach 1696 in France as predicted by OL ---&gt; https://www.facebook.com/permalink.php?story_fbid=2433112246779082&amp;id=361778480579146 #COVID19 #CoronavirusOutbreak #CoronavirusPandemic #CoronaVirusUpdate #France #COVID2019 #VirusCorona #francecoronavirus @fema @CDCgov @FBI @AFP @franceinfo @RTLFrance @FRANCE24",,@fema @CDCgov @FBI @AFP @franceinfo @RTLFrance @FRANCE24,#COVID19 #CoronavirusOutbreak #CoronavirusPandemic #CoronaVirusUpdate #France #COVID2019 #VirusCorona #francecoronavirus,1243324091341262848,https://twitter.com/OracleLaura/status/1243324091341262848
2020-03-26 23:48:57,BD007Marky,,0,0,0,"New video/post on @beforeitsnews: Last Man On Earth: Does Donald Trump Realize He Has an Enemy Within and Where Have All the Fired CEO's Gone? https://beforeitsnews.com/blogging-citizen-journalism/2020/03/last-man-on-earth-does-donald-trump-realize-he-has-an-enemy-within-and-where-have-all-the-fired-ceos-gone-2642523.html #Wormwood #DeborahBirx #YourFired #coronavirus #COVID19",,@beforeitsnews,#Wormwood #DeborahBirx #YourFired #coronavirus #COVID19,1243324090510905353,https://twitter.com/BD007Marky/status/1243324090510905353
2020-03-26 23:48:57,silelf,,0,1,0,"A quick reminder to all #COVID19 #coronavirus ",,,#COVID19 #coronavirus,1243324088560599040,https://twitter.com/silelf/status/1243324088560599040
2020-03-26 23:48:55,JayeDavidson9,CBCNews,1,0,0,"Pandemic refers to an epidemic that has spread over several countries or continents, usually affecting a large number of people & COVID19 is a strain of Coronavirus! @NBCNewsWorld @BBCWorld",,@NBCNewsWorld @BBCWorld,,1243324081904238595,https://twitter.com/JayeDavidson9/status/1243324081904238595
2020-03-26 23:48:55,jenngreenhall,,0,0,1,"Why is the CDC 'sitting on the sidelines' in the Covid-19 fight? - #covid #COVID19 #coronavirus ",,,#covid #COVID19 #coronavirus,1243324080259907584,https://twitter.com/jenngreenhall/status/1243324080259907584
2020-03-26 23:48:53,jpspwf,,0,0,0,"Montana Coronavirus And COVID-19 News http://",,,,1243324072571871237,https://twitter.com/jpspwf/status/1243324072571871237
2020-03-26 23:48:53,SouthlandRemod,,0,0,1,"The comfort & safety of our clients is top priority right now! Here are the precautions our team is taking to help protect your home from COVID-19 during a renovation. https://bit.ly/2Jkr61P #covid19 #coronavirus #losangeles #renovation #remodeling #coronavirusoubreak #corona",,,#covid19 #coronavirus #losangeles #renovation #remodeling #coronavirusoubreak #corona,1243324071057575936,https://twitter.com/SouthlandRemod/status/1243324071057575936
2020-03-26 23:48:51,angelog82070823,,10,30,84,"Do you still believe western media / governments ?? Wake up #COVID19 #coronavirus look for facts. USA is only great in Hollywood movies or self made ranking. ",,,#COVID19 #coronavirus,1243324066477547520,https://twitter.com/angelog82070823/status/1243324066477547520
2020-03-26 23:48:49,DDesBaillets,ranic,1,0,0,"Definitely worth a follow. When #GOP is openly talking about some sort of pandemic driven geriatric-cleansing for the sake of the US economy you know the capitalist crypto-fascists are in full force https://nymag.com/intelligencer/2020/03/dan-patrick-seniors-are-willing-to-die-to-save-economy.html #CoronaVirus #Covid19",,,#GOP #CoronaVirus #Covid19,1243324056025391104,https://twitter.com/DDesBaillets/status/1243324056025391104
2020-03-26 23:48:47,ASIFNASIM15,,0,0,2,"Shame on the popular and most prestigious newspaper for showing your face with a cartoon of Coronavirus with a muslim dress. Stop spreading hate for your business. It seems that you hate the muslims. And their minds are as dirty as Covid-19 #Islamophobia",,,#Islamophobia,1243324047720505344,https://twitter.com/ASIFNASIM15/status/1243324047720505344
2020-03-26 23:48:43,jas0nsg,,0,0,0,"US overtook China #ChineseVirus #ChineseCoronavirus #WuhanCoronavirus #CoronavirusPandemic #COVID2019 #Covid_19 #COVID19 #CoronavirusOutbreak #Coronavirus ",,,#ChineseVirus #ChineseCoronavirus #WuhanCoronavirus #CoronavirusPandemic #COVID2019 #Covid_19 #COVID19 #CoronavirusOutbreak #Coronavirus,1243324029609504768,https://twitter.com/jas0nsg/status/1243324029609504768
2020-03-26 23:48:41,MissionViejoCA,,0,2,1,"Residents can now sign up to receive text message updates related to novel coronavirus (COVID-19) in Orange County. To opt-in for this service, text OCCOVID19 to 888777. https://bit.ly/2JkgCQ2",,,,1243324021787127808,https://twitter.com/MissionViejoCA/status/1243324021787127808
2020-03-26 23:48:37,DenRepublican,,0,0,0,"The U.S. may end up with the worst COVID-19 outbreak in the industrialized world. @edyong209 explains how it will play out: https://www.theatlantic.com/health/archive/2020/03/how-will-coronavirus-end/608719/?utm_source=twitter&amp;utm_medium=social&amp;utm_campaign=share #COVID19 #coronavirus #GenC #pandemic",,@edyong209,#COVID19 #coronavirus #GenC #pandemic,1243324006469472256,https://twitter.com/DenRepublican/status/1243324006469472256
2020-03-26 23:48:33,TimeSystemsInt1,,0,0,0,"How Long Should Social Distancing Last? When Will COVID-19 Coronavirus End? http://dlvr.it/RSdT8b",,,,1243323990124290049,https://twitter.com/TimeSystemsInt1/status/1243323990124290049
2020-03-26 23:48:31,JamesPixton,JBCoke99,0,0,0,"Get used to... the dead bodies? The horror of loved ones dying? The world economy going into the toilet? People dying of strange little things because all our healthcare resources are consumed by #coronavirus #COVID19? Yeah, buddy. #TooMuchWinning #25AmendmentNow",,,#coronavirus #COVID19 #TooMuchWinning #25AmendmentNow,1243323980930355201,https://twitter.com/JamesPixton/status/1243323980930355201
2020-03-26 23:48:30,WWcovid19update,,0,2,1,"NEW: Germany reports 6,615 new cases of coronavirus and 61 new deaths. A total of 43,938 cases and 267 deaths.",,,,1243323977055064064,https://twitter.com/WWcovid19update/status/1243323977055064064
2020-03-26 23:48:30,paul_48n,,0,0,0,"BBC News - Coronavirus: Inside a Covid-19 intensive care unit ",,,,1243323975637192704,https://twitter.com/paul_48n/status/1243323975637192704
2020-03-26 23:48:29,realdevinhammer,,0,0,0,"Bitch, I wanna leave but everyone has diseases. #coronavirus #COVID19 #ChineseVirus #stayhome #SocialDistance #SocialDistancingNow",,,#coronavirus #COVID19 #ChineseVirus #stayhome #SocialDistance #SocialDistancingNow,1243323972722311168,https://twitter.com/realdevinhammer/status/1243323972722311168
2020-03-26 23:48:27,doctorgfitness,,0,0,1,"one thing about us in #America, we have become a very angry people, time to reset that, tune out anger salesman &amp; agents of turmoil from our lives, get back to family, sports, little league, picnics &amp; camping #CoronavirusOubreak #coronaviruske #CovidNGR #COVID19 #coronavirus",,,#America #CoronavirusOubreak #coronaviruske #CovidNGR #COVID19 #coronavirus,1243323965709393920,https://twitter.com/doctorgfitness/status/1243323965709393920
2020-03-26 23:48:27,abj165,,0,0,0,"Coronavirus: Singapore scientists on the front lines of fight against Covid-19 ",,,,1243323962936836096,https://twitter.com/abj165/status/1243323962936836096
2020-03-26 23:48:26,WrathOfKhan2016,,3,7,26,"Can’t wait for the victory press conference tomorrow when we surpass China for most #Coronavirus cases ever!!! Winning! #Resist #COVID19 ",,,#Coronavirus #Resist #COVID19,1243323958696521740,https://twitter.com/WrathOfKhan2016/status/1243323958696521740
2020-03-26 23:48:22,StevenMatsumoto,,0,0,0,"If you or someone you know is in the medical field, and needs N95 masks or other PPE please contact me! I have access to FDA compliant surgical and respirator masks. We can ship anywhere in North America and Europe. #coronavirus #covid19 #n95 #ppe",,,#coronavirus #covid19 #n95 #ppe,1243323941453783047,https://twitter.com/StevenMatsumoto/status/1243323941453783047
2020-03-26 23:48:20,JamesFLoveIV,,0,1,3,"China has 4 times the population of the US, and less impact from the coronavirus. I guess Trump was right. Xi is doing a good job. Coronavirus Update (Live): 529,614 Cases and 23,976 Deaths from COVID-19 Virus Outbreak - Worldometer https://www.worldometers.info/coronavirus/#countries",,,,1243323936491868166,https://twitter.com/JamesFLoveIV/status/1243323936491868166
2020-03-26 23:48:13,Badiah4Bon,,0,0,0,"Tate Reeves, gov of #Mississippi, issued a #COVID19, #Coronavirus executive order which lists most businesses as essential. @TheBlackCaucus @WhipClyburn @CarlEHeastie @BerniceKing @Trevornoah @itsgabrielleu @nytimes @NYCMayor @mjfree @latimes @TheRoot https://m.jacksonfreepress.com/news/2020/mar/24/gov-tate-reeves-orders-limited-gatherings-today-ex/",,@TheBlackCaucus @WhipClyburn @CarlEHeastie @BerniceKing @Trevornoah @itsgabrielleu @nytimes @NYCMayor @mjfree @latimes @TheRoot,#Mississippi #COVID19 #Coronavirus,1243323906951446531,https://twitter.com/Badiah4Bon/status/1243323906951446531
2020-03-26 23:48:13,Mister_Murica_,,0,0,0,"Good lord the #FakeNewsMedia is literally calling 1k deaths apocalyptic. Seriously? Anything to make @realDonaldTrump look bad. #COVID19 #WuhanCoronaVirus #coronavirus #WuhanFlu #KungFlu #ChinaVirus",,@realDonaldTrump,#FakeNewsMedia #COVID19 #WuhanCoronaVirus #coronavirus #WuhanFlu #KungFlu #ChinaVirus,1243323905529376768,https://twitter.com/Mister_Murica_/status/1243323905529376768
2020-03-26 23:48:12,livlivbentley,,0,0,0,"Character is who you are during a pandemic #COVID19 #coronavirus #CoronavirusPandemic #staystrong",,,#COVID19 #coronavirus #CoronavirusPandemic #staystrong,1243323902916517888,https://twitter.com/livlivbentley/status/1243323902916517888
2020-03-26 23:48:11,OldCityServices,,0,1,1,"***BROWARD COUNTY*** 3/26 PM STATS FROM FLA DOH #FLORIDA #FTLAUDERDALE #COVID19 #CORONAVIRUS ",,,#FLORIDA #FTLAUDERDALE #COVID19 #CORONAVIRUS,1243323894926389248,https://twitter.com/OldCityServices/status/1243323894926389248
2020-03-26 23:48:10,economicrefugee,,0,0,0,"This @time when we should be doing more 2protect our lungs by lowering pollution in air we breathe -- since #coronavirus attacks our respiratory system https://thehill.com/policy/energy-environment/489753-epa-suspends-enforcement-of-environmental-laws-amid-coronavirus @EPA turning their backs abandoning protecting America's public health during #COVID19 @RebeccaBeitsch",,@EPA @RebeccaBeitsch,#coronavirus #COVID19,1243323892145328128,https://twitter.com/economicrefugee/status/1243323892145328128
2020-03-26 23:48:09,TomthunkitsMind,,0,0,0,"Watch All Trump's false promises regarding the tests for COVID-19. THEN READ MY OP-ED: THE #CORONAVIRUS TESTS ARE IN THE MAIL. THIS IS THE REAL REASON FOR TESTING DELAYS: https://tinyurl.com/u2rl4wa 08 #VoteBlueNoMatterWho",,,#CORONAVIRUS #VoteBlueNoMatterWho,1243323889721192449,https://twitter.com/TomthunkitsMind/status/1243323889721192449
2020-03-26 23:48:09,gbrodermann,,0,0,0,"We're staying home!! You should too. Staying home with family. Love you Sweetie. #Family #Love #Sweetie #Quarantine #Covid1 #CoronaVirus #Covid19 #StayingHome #StayingHomeWithFamily #StayHome @The Hammocks,… https://www.instagram.com/p/B-N0Gscnt8S/?igshid=17tuuq54gvxa9",,,#Family #Love #Sweetie #Quarantine #Covid1 #CoronaVirus #Covid19 #StayingHome #StayingHomeWithFamily #StayHome,1243323887464648707,https://twitter.com/gbrodermann/status/1243323887464648707
2020-03-26 23:48:09,sellthekids,JohnCornyn,0,0,0,"John, you and @tedcruz need to be seriously working around the clock...New Orleans is the next hot spot and we KNOW that many people in N.O. have family in #HTX. What are you doing to help us, John? Let's see specific example of your leadership. #COVID19 #CoronaVirus #Pandemic",,@tedcruz,#HTX #COVID19 #CoronaVirus #Pandemic,1243323887229829120,https://twitter.com/sellthekids/status/1243323887229829120
2020-03-26 23:48:07,indosthan,,0,0,0,"#India's Finance Minister Nirmala Sitharaman: “We don’t want anyone to remain hungry, and we don’t want anyone to remain without money in their hands.” | @BBC https://www.bbc.com/news/world-asia-india-52047263 #COVID19 #coronavirus",,@BBC,#India #COVID19 #coronavirus,1243323878459363328,https://twitter.com/indosthan/status/1243323878459363328
2020-03-26 23:48:05,RANTER_DAD,,0,0,2,"I wonder if Johnson has ever fallen foul of #ClapForPhilanderers? Harley Street would fix it, eh? #bbcnews #c4news #Newsnight #skynews #skypapers @lbc #covid19 #coronavirus #covid19UK #coronavirusUK",,@LBC,#ClapForPhilanderers #bbcnews #c4news #Newsnight #skynews #skypapers #covid19 #coronavirus #covid19UK #coronavirusUK,1243323872855887873,https://twitter.com/RANTER_DAD/status/1243323872855887873
2020-03-26 23:48:05,janellebeeating,,3,0,8,"Day 10/11. My mom tested positive for covid19/ corona virus. She has pre existing conditions like asthma. She’s in the hospital now sick Send good vibes! going a bit stir crazy inside the house working from and and being forced to stay home because we might have been exposed",,,,1243323871731867664,https://twitter.com/janellebeeating/status/1243323871731867664
2020-03-26 23:48:05,FilmNewsWeb,,0,1,1,"http://Film-News.co.uk Rosie Huntington-Whiteley says self-isolating with her two-year-old son is 'real challenge' - #coronavirus #pandemic #covid19 #RosieHuntingtonWhiteley @rosiehw @RosieHWBR http://dlvr.it/RSdT6c",,@RosieHW @RosieHWBR,#coronavirus #pandemic #covid19 #RosieHuntingtonWhiteley,1243323871492583425,https://twitter.com/FilmNewsWeb/status/1243323871492583425
2020-03-26 23:48:03,WWcovid19update,,1,4,4,"#Coronavirus update, Europe: - Austria: 810 new cases - Portugal: 549 new cases - Sweden: 319 new cases - Czechia: 271 new cases - Norway: 263 new cases - Ireland: 255 new cases - Russia: 182 new cases - Poland: 170 new cases - Denmark: 153 new cases - Finland: 78 new cases",,,#Coronavirus,1243323862235963401,https://twitter.com/WWcovid19update/status/1243323862235963401
2020-03-26 23:48:01,bowmoa_,,1,0,3,"Coronavirus Update (Live): 529,614 Cases and 23,976 Deaths from COVID-19 Virus Outbreak - Worldometer https://www.worldometers.info/coronavirus/",,,,1243323854002327552,https://twitter.com/bowmoa_/status/1243323854002327552
2020-03-26 23:48:00,KISSMediaCo,,0,0,0,"How should you tell your kids about Covid 19 https://bit.ly/39fU7X2 #covid19 #inthistogeather #coronavirus #pandemic #health #wellness #kisa #parents #mentalhealth #psychiatry #pasadena #joeharaszti",,,#covid19 #inthistogeather #coronavirus #pandemic #health #wellness #kisa #parents #mentalhealth #psychiatry #pasadena #joeharaszti,1243323852442292225,https://twitter.com/KISSMediaCo/status/1243323852442292225
2020-03-26 23:47:59,WSMLLEN,,0,0,1,"SBS has launched a multilingual online portal to provide information, in 63 languages, on the COVID-19 outbreak for Australia's diverse communities. https://www.sbs.com.au/news/sbs-launches-online-portal-to-provide-in-language-coronavirus-information @TalkToCMY @CityLLEN @31LLENS @fya_org @YACVic #coronavirus #COVID #COVID2019 #COVID19au",,@TalkToCMY @CityLLEN @31LLENS @fya_org @YACVic,#coronavirus #COVID #COVID2019 #COVID19au,1243323846255472641,https://twitter.com/WSMLLEN/status/1243323846255472641
2020-03-26 23:47:55,D4M4G3ink,fox5sandiego,1,0,0,"COVID-19 is the killer, coronavirus is the flu idiots.... ",,,,1243323831298613250,https://twitter.com/D4M4G3ink/status/1243323831298613250
2020-03-26 23:47:53,AgneyPatel,,0,0,0,"Have you ever imagined you’d save a human life facing critical life threatening situation ? Surely that moment would be one of the proudest moments of your entire life. That golden opportunity is here now. Grab it just by staying home! #COVID19 #coronavirus",,,#COVID19 #coronavirus,1243323821693833216,https://twitter.com/AgneyPatel/status/1243323821693833216
2020-03-26 23:47:52,egerphd,txst,0,0,2,"For all that live in #HaysCounty and for #TXST students, faculty, and staff. Read more below about new #StayAtHome order to begin tonight and how it could impact you. #COVID19 #coronavirus ",,,#HaysCounty #TXST #StayAtHome #COVID19 #coronavirus,1243323817012928512,https://twitter.com/egerphd/status/1243323817012928512
2020-03-26 23:47:49,davidmryder,,0,9,53,"More big news from Kirkland today: Judie Shape, 81, who had been diagnosed with COVID-19 and was a resident at Life Care Center of Kirkland, left the facility today to go home with her daughter, Lori Spencer. For @reuters. #coronavirus ",,@Reuters,#coronavirus,1243323806149558272,https://twitter.com/davidmryder/status/1243323806149558272
2020-03-26 23:47:49,ninaandtito,,2,28,52,"Keith Lawrence Middlebrook Arrested on Federal Charges Alleging Fraudulent Investment Scheme Featuring Bogus Claims of COVID-19 Cure &gt;2M Have Seen YouTube, Instagram Videos that Falsely Claim He Developed Coronavirus Prevention Pill &amp; Injectable Cure ",,,,1243323803519705088,https://twitter.com/ninaandtito/status/1243323803519705088
2020-03-26 23:47:47,daav9,,0,0,0,"Trump's America First? HUFFPO: U.S. LEADS WORLD IN CASES. https://www.huffpost.com/?icid=hjx004 #coronavirus #COVID19",,,#coronavirus #COVID19,1243323797870194690,https://twitter.com/daav9/status/1243323797870194690
2020-03-26 23:47:46,shinonomecho,,0,0,0,"Japan, spared mass outbreak so far, now sees national crisis after Tokyo surge - Japan Today https://japantoday.com/category/national/Japan-spared-mass-outbreak-so-far-now-sees-national-crisis-after-Tokyo-surge#.Xn0_BIkdN80.twitter #Tokyo #Japan #coronavirus #COVID19 #ChinaVirus",,,#Tokyo #Japan #coronavirus #COVID19 #ChinaVirus,1243323793734381569,https://twitter.com/shinonomecho/status/1243323793734381569
2020-03-26 23:47:43,937NOW_,,0,0,0,"Young Adult In Kentucky Gets COVID-19 After Going To Coronavirus Party ",,,,1243323779788529664,https://twitter.com/937NOW_/status/1243323779788529664
2020-03-26 23:47:42,maggiemfox,,0,0,2,"Good time to review this one on spreading snot #covid19 #coronavirus ",,,#covid19 #coronavirus,1243323775917133825,https://twitter.com/maggiemfox/status/1243323775917133825
2020-03-26 23:47:42,_BreakingNews24,,0,0,0,"The amount of Coronavirus fatalities has jumped dramatically within the last 24 hours. The daily figure has reached over one hundred for the first time. #Coronavirus #COVID19 ",,,#Coronavirus #COVID19,1243323774046437379,https://twitter.com/_BreakingNews24/status/1243323774046437379
2020-03-26 23:47:41,EdcrowB,realDonaldTrump,0,1,0,"#PINO SHUT UP. HAD ENOUGH OF YOUR BS! #coronavirus #Covid_19 #coronapocolypse #CoronavirusPandemic #CoronavirusOutbreak @realDonaldTrump is #NotMyPresident is the #KingOfFools and is #ShamingTheUSA and #DestroyingTheUSA!!",,@realDonaldTrump,#PINO #coronavirus #Covid_19 #coronapocolypse #CoronavirusPandemic #CoronavirusOutbreak #NotMyPresident #KingOfFools #ShamingTheUSA #DestroyingTheUSA,1243323770317619200,https://twitter.com/EdcrowB/status/1243323770317619200
2020-03-26 23:47:41,Robbi62,,0,1,1,"All media should be playing these messages .@cnn .@msnbc .@foxnews .@abcnews .@cbs RT @CDCgov: Together we can help stop the spread of coronavirus. Learn ways to protect yourself and others at http://www.cdc.gov/covid19. #COVID19 ",,@CNN @MSNBC @FoxNews @abcnews @CBS @CDCgov,#COVID19,1243323769550180353,https://twitter.com/Robbi62/status/1243323769550180353
