date,username,to,replies,retweets,favorites,text,geo,mentions,hashtags,id,permalink
2020-03-26 23:44:58,GimmeObama,realDonaldTrump,1,1,1,"#COVID19Deaths #COVID19 #TRUMPVIRUS #GOPVIRUS #coronavirus #CoronavirusPandemic BLOOD ON YOUR HANDS @GOP #GOPGENOCIDE #NegligibleGOPHomicide #WhereAreTheCOVID19Tests? #WhereAreTheMasks?? #WhereAreTheVentilators ??",,@GOP,#COVID19Deaths #COVID19 #TRUMPVIRUS #GOPVIRUS #coronavirus #CoronavirusPandemic #GOPGENOCIDE #NegligibleGOPHomicide #WhereAreTheCOVID19Tests #WhereAreTheMasks #WhereAreTheVentilators,1243323088219058176,https://twitter.com/GimmeObama/status/1243323088219058176
2020-03-26 23:44:58,recruitmentstu1,,0,0,0,"We are here with you. Our team is contactable via Zoom, mobile and email. #RecruitmentStudio #OnlyHuman #YourKindOfPeople #RecruitmentAgency #Recruitment #HR #WeAreHere #WorkTogether #InThisTogether #HereForYou #TogetherAtHome #StaySafe #coronavirus #covid19 #covid #COVID19nz",,,#RecruitmentStudio #OnlyHuman #YourKindOfPeople #RecruitmentAgency #Recruitment #HR #WeAreHere #WorkTogether #InThisTogether #HereForYou #TogetherAtHome #StaySafe #coronavirus #covid19 #covid #COVID19nz,1243323087803895808,https://twitter.com/recruitmentstu1/status/1243323087803895808
2020-03-26 23:44:56,borderObserver,,0,1,1,"Senate Intel chair unloaded stocks in mid-February before #coronavirus rocked markets https://www.opensecrets.org/news/2020/03/burr-unloaded-stocks-before-coronavirus/ 19 Mar 2020 #QUOTE .. sold between $628,000 and $1.7 million in publicly traded stocks .. #WuhanVirus #COVID19 #ChineseVirus qt-covid19-news-104 by #BorderObserver",,,#coronavirus #QUOTE #WuhanVirus #COVID19 #ChineseVirus #BorderObserver,1243323080115728385,https://twitter.com/borderObserver/status/1243323080115728385
2020-03-26 23:44:56,OldCityServices,,0,0,0,"***ST JOHNS COUNTY*** 3/26 PM STATS FROM FLA DOH #FLORIDA #COVID19 #CORONAVIRUS ",,,#FLORIDA #COVID19 #CORONAVIRUS,1243323077754306567,https://twitter.com/OldCityServices/status/1243323077754306567
2020-03-26 23:44:55,ESUSMX,,0,0,0,"@MSNBC &amp; @CNN don't want the media to continue the daily pressers about the #Coronavirus (#COVID19) because @realDonaldTrump shows great leadership with medical experts &amp; well informed personnel. Trump has destroyed the evil picture the media has painted of him since 2016.",,@MSNBC @CNN @realDonaldTrump,#Coronavirus #COVID19,1243323076319870987,https://twitter.com/ESUSMX/status/1243323076319870987
2020-03-26 23:44:54,TheFameSpot,,0,0,1,"Please share this message it is important #COVID2019 #COVID19 #ktla retweet please. #cnn #coronavirus ",,,#COVID2019 #COVID19 #ktla #cnn #coronavirus,1243323071898906627,https://twitter.com/TheFameSpot/status/1243323071898906627
2020-03-26 23:44:53,Grnsoccershoe,,0,0,0,"I feel sorry for our neighbors to the south that has a twat as president that always wants to be ""winning"" and #1. Unfortunately he got his wish and Americans pay the price. #COVID19 #TRUMPVIRUS The U.S. Now Leads the World in Confirmed Coronavirus Cases ",,,#COVID19 #TRUMPVIRUS,1243323067826225152,https://twitter.com/Grnsoccershoe/status/1243323067826225152
2020-03-26 23:44:53,mmtexas,jaketapper,0,0,1,"Way to go, #Trump. You always gotta be on top... #PandemicPresident #PresidentPandemic #CongratulationsAmerica #StayHome #CoronavirusOubreak #Lockdown #Coronavirus #TrumpIsTheWORSTPresidentEVER #TrumpSlump #COVID19 ",,,#Trump #PandemicPresident #PresidentPandemic #CongratulationsAmerica #StayHome #CoronavirusOubreak #Lockdown #Coronavirus #TrumpIsTheWORSTPresidentEVER #TrumpSlump #COVID19,1243323067641856001,https://twitter.com/mmtexas/status/1243323067641856001
2020-03-26 23:44:53,OCFA_PIO,,5,32,124,"Do you ever wonder if you are far enough away while practicing social distancing? At OCFA we found some ways to maintain the recommended six feet. #coronavirus #FlattenTheCurve #COVID19 #OrangeCounty #SocialDistance",,,#coronavirus #FlattenTheCurve #COVID19 #OrangeCounty #SocialDistance,1243323066010046464,https://twitter.com/OCFA_PIO/status/1243323066010046464
2020-03-26 23:44:51,CRTV_web,,1,4,19,"#Covid19 Stemming down the spread of the #Coronavirus in the country through tracking suspected cases within communities was the main focus of the cabinet meeting chaired by Prime Minister Chief Dr Joseph Dion Njute",,,#Covid19 #Coronavirus,1243323056547860485,https://twitter.com/CRTV_web/status/1243323056547860485
2020-03-26 23:44:50,Phoenixtl,OaklandNurse,0,0,0,"This country is not prepared for #COVID19 #coronavirus pandemic. #Hospitals &amp; #healthcare workers don't have the supplies &amp; support they need. #ProtectNurses #PPEShortage",,,#COVID19 #coronavirus #Hospitals #healthcare #ProtectNurses #PPEShortage,1243323055331397632,https://twitter.com/Phoenixtl/status/1243323055331397632
2020-03-26 23:44:50,bigboijxsh,,0,0,0,"this #COVID19 shit just proves how dirty y’all niggas are... ain’t nobody was washing they hands this often before the #coronavirus was a thing #COVID #COVIDー19 #memes",,,#COVID19 #coronavirus #COVID #COVID #memes,1243323053674827776,https://twitter.com/bigboijxsh/status/1243323053674827776
2020-03-26 23:44:49,newschannelnine,,2,0,2,"GEORGIA CORONAVIRUS CASES: Georgia DPH confirms 1,643 COVID-19 cases in state as of March 26, 56 confirmed deaths. LOCAL CASES: Whitfield: 6 Catoosa: 1 Chattooga: 1 SEE MORE: https://newschannel9.com/news/coronavirus/current-updated-list-of-total-number-of-covid-19-cases-in-georgia",,,,1243323051456028674,https://twitter.com/newschannelnine/status/1243323051456028674
2020-03-26 23:44:49,theintercept,,8,57,64,"Italy’s coronavirus nightmare could happen in the U.S. within days or weeks, ex-CDC chief says. https://interc.pt/2WLEkfX #Covid19",,,#Covid19,1243323050940039170,https://twitter.com/theintercept/status/1243323050940039170
2020-03-26 23:44:45,stefancaliaro,,0,0,0,"""It's too late for #NewYork, but not for #Sydney"" :O #COVID19 #Coronavirus ",,,#NewYork #Sydney #COVID19 #Coronavirus,1243323034447970304,https://twitter.com/stefancaliaro/status/1243323034447970304
2020-03-26 23:44:45,xiiitri,,0,0,0,"Every Thursday 8pm for the NHS and care workers, let's do it! #NHS #ClapforCarers #Istayhome #strongertogether #washyourhands #covid19 #greatbritain #coronavirus #Applause #share #sharethelove #socialdistancing #flattenthecurve #thursdaysateight #stayhomestaysafe #togetherathome",,,#NHS #ClapforCarers #Istayhome #strongertogether #washyourhands #washyourhands #covid19 #greatbritain #coronavirus #Applause #share #sharethelove #socialdistancing #flattenthecurve #thursdaysateight #stayhomestaysafe #togetherathome,1243323034104147971,https://twitter.com/xiiitri/status/1243323034104147971
2020-03-26 23:44:45,msanthropemedia,JoeNBC,0,1,1,"Look at all that testing! The beautiful testing! We're #1! #trumpmassacre #trumpvirus #coronavirus #COVID19 ",,,#trumpmassacre #trumpvirus #coronavirus #COVID19,1243323032573263873,https://twitter.com/msanthropemedia/status/1243323032573263873
2020-03-26 23:44:45,rhontwit,c_johansen_MT,0,0,1,"Holy crap, I wish I had a tenth of the trump ability to ignore reality. It was be nice once in a while. #IllegitimatePresident #BlueWave2020 #AnybodyButTrump2020 #Covid_19 #coronavirus #TrumpVirus #TheMadKing",,,#IllegitimatePresident #BlueWave2020 #AnybodyButTrump2020 #Covid_19 #coronavirus #TrumpVirus #TheMadKing,1243323030719336451,https://twitter.com/rhontwit/status/1243323030719336451
2020-03-26 23:44:38,K2_BD,jaketapper,0,0,0,"@realDonaldTrump @POTUS @Mike_Pence @VP Nice work ass bags #coronavirus #COVID19 #TrumpPlague",,@realDonaldTrump @POTUS @Mike_Pence @VP,#coronavirus #COVID19 #TrumpPlague,1243323001824784387,https://twitter.com/K2_BD/status/1243323001824784387
2020-03-26 23:44:37,Fink_about_it,,2,0,19,"Good news! I finally got approved to get a #COVID19 test. Bad news? I may have to wait up to a week to get the test in #LosAngeles due to backups in the scheduling. p.s. if this really is the novel coronavirus these symptoms are all over the place coming and going.",,,#COVID19 #LosAngeles,1243322997378703360,https://twitter.com/Fink_about_it/status/1243322997378703360
2020-03-26 23:44:35,wjz,,4,5,3,"Coronavirus Latest: 580 COVID-19 Cases In Maryland https://baltimore.cbslocal.com/2020/03/26/coronavirus-latest-580-covid-19-cases-in-maryland/?taid=5e7d3e62e370aa0001622ce2&amp;utm_campaign=trueAnthem%3A+Trending+Content&amp;utm_medium=trueAnthem&amp;utm_source=twitter",,,,1243322991611727872,https://twitter.com/wjz/status/1243322991611727872
2020-03-26 23:44:35,evankirstel,,7,54,89,"Has this hit your supermarket yet? @IrmaRaste @eViRaHealth #coronavirus #COVIDー19 #COVID19 #CoronavirusPandemic #staysafe #CoronavirusOubreak #shopping",,@IrmaRaste @eViRaHealth,#coronavirus #COVID #COVID19 #CoronavirusPandemic #staysafe #CoronavirusOubreak #shopping,1243322990609207297,https://twitter.com/evankirstel/status/1243322990609207297
2020-03-26 23:44:34,Prometi0,,0,0,0,"#CongratulationsAmerica for being the country with the most COVID-19 cases! Now let's continue discussing which of my grandparents I should sacrifice to keep the economy rolling. #coronavirus ",,,#CongratulationsAmerica #coronavirus,1243322988377694208,https://twitter.com/Prometi0/status/1243322988377694208
2020-03-26 23:44:34,roy_roydweaver,,0,0,0,"Since the U.S. now has more known Coronavirus/ COVID-19 cases than any other country, I'm moving to Antarctica, since they don't have any cases of the Coronavirus. ",,,,1243322988264599555,https://twitter.com/roy_roydweaver/status/1243322988264599555
2020-03-26 23:44:33,swcawthon,,0,3,3,"Thrilled to be interviewed by @Jung_Carrie at @WBUR @WBUREdify about access for deaf students during #coronavirus #COVID19. Thank you for amplifying issues for #Deaf and #DisabilityRights everywhere.",,@Jung_Carrie @WBUR @WBUREdify,#coronavirus #COVID19 #Deaf #DisabilityRights,1243322983504117762,https://twitter.com/swcawthon/status/1243322983504117762
2020-03-26 23:44:29,joyceyvr,WestVanDistrict,0,0,0,"So sad that we're losing more local parks because people can't maintain their distance. Three less places to go for North Shore locals. #socialdistancing #PhysicalDistancing #coronavirus #COVID19 #westvan #northvan",,,#socialdistancing #PhysicalDistancing #coronavirus #COVID19 #westvan #northvan,1243322965678153728,https://twitter.com/joyceyvr/status/1243322965678153728
2020-03-26 23:44:29,EnterpriserSTE,,0,0,0,"Coronavirus death toll climbs in Virginia Virginia Health Department officials say there are now up to 300+ confirmed cases in Virginia. RICHMOND, Va. — COVID-19 .....read more. https://www.enterprisersuite.com/coronavirus-death-toll-climbs-in-virginia/?utm_source=twitter&amp;utm_medium=social+to+Twitter&amp;utm_campaign=ReviveOldPostTwitter",,,,1243322964717731843,https://twitter.com/EnterpriserSTE/status/1243322964717731843
2020-03-26 23:44:28,thagreat_1,,0,0,1,"So if we get the stimulus check for the covid19, will we take a hit from are taxes in 2020? #coronavirus #COVID19 #StimulusPackage #USA #Georgia",,,#coronavirus #COVID19 #StimulusPackage #USA #Georgia,1243322962490556416,https://twitter.com/thagreat_1/status/1243322962490556416
2020-03-26 23:44:27,JudyArce,,0,0,0,"May we get through this together #judyarce #newyork #longisland #longislandbusiness #motivation #ilovenewyork #covid_19 #weareallinthistogether #coronavirus @Long Island, NY https://www.instagram.com/p/B-Nzro0n9tl/?igshid=1ly2z16wgg7ci",,,#judyarce #newyork #longisland #longislandbusiness #motivation #ilovenewyork #covid_19 #weareallinthistogether #coronavirus,1243322958799671306,https://twitter.com/JudyArce/status/1243322958799671306
2020-03-26 23:44:27,bezmah,,0,0,4,"I was today years old when I learned that Covid-19 stands for Coronavirus disease 2019.... I’ll need all of self quarantine to process this new information ",,,,1243322958602477569,https://twitter.com/bezmah/status/1243322958602477569
2020-03-26 23:44:26,sherylrockin,,0,0,1,"BREAKING: Church of Jesus Christ of Latter Day Saints Presidents invites the world to fast and pray over #coronavirus #COVID19 @Ch_JesusChrist https://kslnewsradio.com/1922027/president-russell-m-nelson-invites-the-world-to-fast-and-pray/",,@Ch_JesusChrist,#coronavirus #COVID19,1243322953548234757,https://twitter.com/sherylrockin/status/1243322953548234757
2020-03-26 23:44:25,JohnathanPerk,,1,3,6,"Any social justice activists/organizations having #reparations discussions, amid all this talk of the our elected officials assessing which citizens ""most deserve"" a government check? I'm not the only equity-minded person thinking this. #BlackLivesMatter #COVID19 #coronavirus",,,#reparations #BlackLivesMatter #BlackLivesMatter #COVID19 #coronavirus,1243322949299392513,https://twitter.com/JohnathanPerk/status/1243322949299392513
2020-03-26 23:44:24,XpenseReduction,,0,0,0,"A lot of employers are having to manage remote working environments for the first time. Here are a few tips to keep your team on task. #RemoteWork #WorkplaceSafety #RemoteWorking #COVID19 #Coronavirus #Tips",,,#RemoteWork #WorkplaceSafety #RemoteWorking #COVID19 #Coronavirus #Tips,1243322944165761028,https://twitter.com/XpenseReduction/status/1243322944165761028
2020-03-26 23:44:23,secretspartanuk,,0,0,0,"Coronavirus: Britons saying final goodbyes to dying relatives by videolink - Restrictions on visits to patients with Covid-19 mean such farewells are increasingly necessary via /r/technology ",,,,1243322940860530695,https://twitter.com/secretspartanuk/status/1243322940860530695
2020-03-26 23:44:23,maxmaxx1965,,1,1,0," Drinking Holy Water to prevent getting Coronavirus disease.. In Italy to prevent covid-19 everyone using same spoon to drink Holy Water. ",,,,1243322939803488256,https://twitter.com/maxmaxx1965/status/1243322939803488256
2020-03-26 23:44:21,BorisPaloma,,0,1,1,"We're number 1! Thank you asshole @realDonaldTrump #coronavirus #COVID19 ",,@realDonaldTrump,#coronavirus #COVID19,1243322931419242501,https://twitter.com/BorisPaloma/status/1243322931419242501
2020-03-26 23:44:20,Aka4cTwtichTv,handleyzo,0,0,0,"BURN THEM BERNIE ROAST THAT PORK! #BernieForPresident #WeNotMe #Bernie2020 #PeopleOverProfits #StateOfEmergency #COVID19 #coronavirus #Quarantine #CongratulationsAmerica",,,#BernieForPresident #WeNotMe #Bernie2020 #PeopleOverProfits #StateOfEmergency #COVID19 #coronavirus #Quarantine #CongratulationsAmerica,1243322928403546115,https://twitter.com/Aka4cTwtichTv/status/1243322928403546115
2020-03-26 23:44:20,DrewRamsey1215,,0,0,0,"@GovWhitmer #COVID19 question: Can the #coronavirus live on dollar bills and coins? And if so, for how long?",,@GovWhitmer,#COVID19 #coronavirus,1243322927212355585,https://twitter.com/DrewRamsey1215/status/1243322927212355585
2020-03-26 23:44:19,rafaelwv,,0,0,0,"Coronavirus: Britons saying final goodbyes to dying relatives by videolink - Restrictions on visits to patients with Covid-19 mean such farewells are increasingly necessary via /r/technology https://ift.tt/2QLrRW0",,,,1243322925136183299,https://twitter.com/rafaelwv/status/1243322925136183299
2020-03-26 23:44:17,aaronmdaley,,0,0,0,"#Coronavirus Resource Center - #Harvard #Health https://www.health.harvard.edu/diseases-and-conditions/coronavirus-resource-center #COVID19",,,#Coronavirus #Harvard #Health #COVID19,1243322915602366464,https://twitter.com/aaronmdaley/status/1243322915602366464
2020-03-26 23:44:17,sellthekids,,0,0,0,"Wow - we've taken the lead and maintained our 1.4% case mortality rate. The next 4 weeks are going to be really, really bad. #StayHome #ShelterInPlace #COVID19 #CoronaVirus ",,,#StayHome #ShelterInPlace #COVID19 #CoronaVirus,1243322913761169409,https://twitter.com/sellthekids/status/1243322913761169409
2020-03-26 23:44:15,TomthunkitsMind,,0,0,3,"Watch the Pope walk around an empty Rome praying for an end to the COVID-19 pandemic #CORONAVIRUS 02 #FBR",,,#CORONAVIRUS #FBR,1243322907528396800,https://twitter.com/TomthunkitsMind/status/1243322907528396800
2020-03-26 23:44:13,Hussaini_Hamzah,,1,0,0,"Hello! Good evening my brothers and sisters, as a citizen of Nigeria and indigenous of Adamawa state I may like to use the opportunity of this platform to urge you to continue praying to our nation and our lovely state on the ongoing pandemic Corona virus (COVID-19",,,,1243322897265045505,https://twitter.com/Hussaini_Hamzah/status/1243322897265045505
2020-03-26 23:44:11,PoconoRecord,,0,0,1,"Coronavirus live updates: Record unemployment claims; Senate passes historic $2T stimulus; US deaths top 1,000 https://www.poconorecord.com/zz/news/20200326/coronavirus-live-updates-record-unemployment-claims-senate-passes-historic-2t-stimulus-us-deaths-top-1000 #COVID19 #UnemploymentNumber #stimulusbill #deaths",,,#COVID19 #UnemploymentNumber #stimulusbill #deaths,1243322891258691587,https://twitter.com/PoconoRecord/status/1243322891258691587
2020-03-26 23:44:10,barbara_volkwyn,,0,0,1,"Every SA website must promote the govt portal on #Covid-19, and cell number transfers banned https://www.businessinsider.co.za/no-number-portability-and-forced-links-to-the-sa-govt-coronavirus-website-2020-3 #coronavirus #coronavirussa #coronavirusinsa #covid19sa #coronavirusafrica",,,#Covid #coronavirus #coronavirussa #coronavirusinsa #covid19sa #coronavirusafrica,1243322884157853698,https://twitter.com/barbara_volkwyn/status/1243322884157853698
2020-03-26 23:44:09,rilgossiponline,,0,0,0,"Watch uncle vexing , I mean uncle dey para for Corona virus . . . . . . . . . . . . . #covid19 #coronavirus #china #nigeria #africa #america #stayathome #sub4sub #followforfollowback #subaru… https://www.instagram.com/p/B-NzlPJg8Cw/?igshid=abp8itpvafss",,,#covid19 #coronavirus #china #nigeria #africa #america #stayathome #sub4sub #followforfollowback #subaru,1243322879879643141,https://twitter.com/rilgossiponline/status/1243322879879643141
2020-03-26 23:44:08,VOANews,,2,26,56,"CORONAVIRUS: Long lines form in front of a supermarket in Chile's capital, as people rush to buy the basics before the start of a nationwide quarantine mandated by the government in an effort to stop the spread of COVID-19. (AFP) ",,,,1243322877321101317,https://twitter.com/VOANews/status/1243322877321101317
2020-03-26 23:44:06,LeonHartwell,,0,0,1,"Here is @LowyInstitute's 4th COVIDCast which focuses on Indonesia's response to #COVID19. https://www.lowyinstitute.org/publications/covidcast-episode-4-crisis-looms-southeast-asia #coronavirus @benjaminbland @mfullilove",,@LowyInstitute @benjaminbland @mfullilove,#COVID19 #coronavirus,1243322869460787201,https://twitter.com/LeonHartwell/status/1243322869460787201
2020-03-26 23:44:06,HansRieber,,0,0,0,"@BillGates for president #COVID #COVID19 #trump #NewYork #California #sandiego #coronavirus",,@BillGates,#COVID #COVID19 #trump #NewYork #California #sandiego #coronavirus,1243322867640496128,https://twitter.com/HansRieber/status/1243322867640496128
2020-03-26 23:44:04,billingsgazette,,0,5,6,"North Dakota Gov. Doug Burgum gave a sobering message Thursday to people who are complaining that some of the counties identified with patients who have contracted the coronavirus aren't accurate: COVID-19 is coming to your county. ",,,,1243322862531948547,https://twitter.com/billingsgazette/status/1243322862531948547
2020-03-26 23:44:04,KenMac55,,0,0,0,"“You don’t know what the numbers are in China. China tells you the numbers,” @realDonaldTrump says. https://dailysign.al/2UmJFZE via @FredLucasWH @DailySignal #coronavirus #COVID19 #ChineseVirus",,@realDonaldTrump @FredLucasWH @DailySignal,#coronavirus #COVID19 #ChineseVirus,1243322860472500224,https://twitter.com/KenMac55/status/1243322860472500224
2020-03-26 23:44:03,Chapman_Avalon,sunlorrie,0,0,4,"March 4th @ErinOTooleMP put out a policy plan to address Coronavirus/COVID-19. At time he was called racist &amp; alarmist. Many of his suggestions have been implemented in last week. We lost over 2 weeks. We all know how critical each day has been. This is leadership we need &amp; lack ",,@ErinOTooleMP,,1243322858727768064,https://twitter.com/Chapman_Avalon/status/1243322858727768064
2020-03-26 23:44:03,xxcafeprimaxx,,0,0,0,"The #US has outscored #China. As always, they must be in the first place, even in #coronavirus #Covid_19 #COVID19 ",,,#US #China #coronavirus #Covid_19 #COVID19,1243322855221272579,https://twitter.com/xxcafeprimaxx/status/1243322855221272579
2020-03-26 23:44:03,mbchoe,,0,0,0,"At-Home Coronavirus (COVID-19) Test Kit | Everlywell says kits are unavailable for non hospital staff. But this is a lie. Hospitals would test using PCR not a home kit ",,,,1243322854831034368,https://twitter.com/mbchoe/status/1243322854831034368
2020-03-26 23:44:01,sdcwa,,0,2,3,"Farmers Feeding the World: Imperial Valley vegetable farmers add additional safety precautions during the ongoing harvest in light of the coronavirus pandemic. Story by @IVSDCURRENTS https://bit.ly/33Mmhb0 #cawater #agriculture #essentialwork #coronavirus #COVID19 #farmers",,@IVSDCURRENTS,#cawater #agriculture #essentialwork #coronavirus #COVID19 #farmers,1243322847931629570,https://twitter.com/sdcwa/status/1243322847931629570
2020-03-26 23:44:01,andre__levy,,0,0,0,"Coronavirus Symptoms vs Flu vs Cold vs Allergies. Which one do you have and is it time to see a doctor? Severe acute respiratory syndrome-related coronavirus 2, which causes the disease called COVID-19, and that everyone simply calls Coronavirus has spre… ",,,,1243322847910649856,https://twitter.com/andre__levy/status/1243322847910649856
2020-03-26 23:44:01,BrewviesWthMatt,atrupar,1,1,1,"Hey @CNN @MSNBC @ABC @CBSNews and yes, even @FoxNews... can we just collectively, as a united country, agree to not air a SINGLE WORD that @realDonaldTrump says? He’s a vile self absorbed human being that constantly lies to the country. Please? #Covid19 #COVID2019 #Coronavirus ",,@CNN @MSNBC @ABC @CBSNews @FoxNews @realDonaldTrump,#Covid19 #COVID2019 #Coronavirus,1243322846404734977,https://twitter.com/BrewviesWthMatt/status/1243322846404734977
2020-03-26 23:43:59,RickyJMarc,,0,0,1,"God bless our tireless, overworked, and underpaid medical workers fighting around the clock (at great risk to their own lives) to help curb the losses brought about by the #Coronavirus (#COVID19) pandemic. You deserve so much more than the applause we shower you with every night. ",,,#Coronavirus #COVID19,1243322840826417152,https://twitter.com/RickyJMarc/status/1243322840826417152
2020-03-26 23:43:59,BRN2BL8,,0,1,0,"#Coronavirus investigators one step closer to solving mystery of 'patient zero' #ChinaLiedPeopleDied #ChineseVirus19 #ChineseVirus #China #COVID19 https://fxn.ws/3dqg0pU #FoxNews",,,#Coronavirus #ChinaLiedPeopleDied #ChineseVirus19 #ChineseVirus #China #COVID19 #FoxNews,1243322840809713666,https://twitter.com/BRN2BL8/status/1243322840809713666
2020-03-26 23:43:58,PoconoHYanulus,,0,0,0,"Coronavirus live updates: Record unemployment claims; Senate passes historic $2T stimulus; US deaths top 1,000 https://www.poconorecord.com/zz/news/20200326/coronavirus-live-updates-record-unemployment-claims-senate-passes-historic-2t-stimulus-us-deaths-top-1000 #COVID19 #UnemploymentNumber #stimulusbill #deaths",,,#COVID19 #UnemploymentNumber #stimulusbill #deaths,1243322835730403333,https://twitter.com/PoconoHYanulus/status/1243322835730403333
2020-03-26 23:43:57,ReadingEagle,,0,0,0,"Letter: President’s defender uses a classic Trump maneuver https://bit.ly/2UhYOvk #Opinion #Letter #LetterToTheEditor #Trump #China #Coronavirus #COVID19",,,#Opinion #Letter #LetterToTheEditor #Trump #China #Coronavirus #COVID19,1243322831280263168,https://twitter.com/ReadingEagle/status/1243322831280263168
2020-03-26 23:43:57,Ezee_EP,,0,0,1,"Someone at the barber said Unemployment Offc holds back the 1st weeks check. For the 3.3 mill filled this week will see their first payment April 10. (Good Friday) #COVID19 #coronavirus",,,#COVID19 #coronavirus,1243322830898462721,https://twitter.com/Ezee_EP/status/1243322830898462721
2020-03-26 23:43:53,swedishbriefs,,0,0,0,"“Kids whose parents are now raiding the internet for kitchen science experiments will lose less ground academically over this long summer than those whose parents struggle with basic maths themselves” https://gu.com/p/dgznf/stw #covid19 #coronavirus #schoolsclosure #UK",,,#covid19 #coronavirus #schoolsclosure #UK,1243322814335258624,https://twitter.com/swedishbriefs/status/1243322814335258624
2020-03-26 23:43:52,verbaliza,,0,1,0,"Northern Grampians has now recorded its second confirmed case of coronavirus COVID-19 - the third case for the Wimmera. ",,,,1243322809415127040,https://twitter.com/verbaliza/status/1243322809415127040
2020-03-26 23:43:50,my234Radio,,0,0,0,"Now Playing on 234Radio, Boyz II Men - I'll Make Love to You. Together, we can defeat coronavirus disease (COVID-19) #LetsFightCovid19 #CovidNGR",,,#LetsFightCovid19 #CovidNGR,1243322800661827584,https://twitter.com/my234Radio/status/1243322800661827584
2020-03-26 23:43:45,Dvilwmn,ifindkarma,0,0,0,"#Trump is lying! We don't have to die to keep Trump rich! #StopTheSpread #DumpTrump2020 #coronavirus #COVID19 ",,,#Trump #StopTheSpread #DumpTrump2020 #coronavirus #COVID19,1243322779715252226,https://twitter.com/Dvilwmn/status/1243322779715252226
2020-03-26 23:43:44,Kimbagirl4u,,0,0,0,"@DailyMail Headline ""17 yo child"" dies of Covid19. But also suggests 16 yo's should vote Seventeen-year-old dies from coronavirus in New Orleans https://mol.im/a/8157769 @MailOnline",,@DailyMail @MailOnline,,1243322778150993920,https://twitter.com/Kimbagirl4u/status/1243322778150993920
2020-03-26 23:43:43,FunmilayOsabinu,,0,0,0,"Corona Virus is very respectful. The only disease that came into the country and went to greet the leaders first. #COVID19",,,#COVID19,1243322772950056960,https://twitter.com/FunmilayOsabinu/status/1243322772950056960
